{
  "agent_id": "agent-valid-minimal",
  "agent_type": "local",
  "display_name": "Valid Minimal Agent",
  "owner_actor_id": "actor-owner-001",
  "workspace_id": "workspace-alpha",
  "delegation_scope": ["verify", "read_receipts"],
  "allowed_tools": ["axiom.verify"],
  "allowed_memory_scopes": ["read_only_context"],
  "allowed_connectors": ["local_stdio_mcp"],
  "risk_tier": "low",
  "trust_tier": "probationary",
  "policy_version": "v5-planning-identity-1",
  "issued_at": "2026-07-05T00:00:00.000Z",
  "expires_at": "2027-07-05T00:00:00.000Z",
  "revoked_at": null,
  "revocation_reason": null,
  "parent_agent_id": null,
  "delegation_chain": [],
  "receipt_refs": ["receipt-agent-valid-minimal"],
  "provenance_refs": ["provenance-agent-valid-minimal"],
  "audit_requirements": ["trust_receipt", "provenance_ref"],
  "verification_status": "registered",
  "expected_status": "valid",
  "expected_reason_code": null
}
